{"ambiguities":[],"candidate_witness_material":[{"capture_contract_record_ids":["zbf1404c0dfb0e83a"],"contract_record_ids":["z4e166b0e99daa3b0"],"exact_type":"array","full_json_pointer":"/records/2/data/entries","is_container":true,"json_pointer_relative_to_data":"/entries","linked_record_ids":[],"record_id":"z1deeb2cb7d942540","value":[{"attempt_token":"z4da1b3149655f568","operation_token":"z54bf6985c0ce3b82","sequence":1},{"attempt_token":"zde4e9e15ce8a4f85","operation_token":"z54bf6985c0ce3b82","sequence":2}]},{"capture_contract_record_ids":["zbf1404c0dfb0e83a"],"contract_record_ids":["z4e166b0e99daa3b0"],"exact_type":"array","full_json_pointer":"/records/5/data/entries","is_container":true,"json_pointer_relative_to_data":"/entries","linked_record_ids":[],"record_id":"z04dfbc829c4fa331","value":[{"attempt_token":"z4da1b3149655f568","operation_token":"z54bf6985c0ce3b82","sequence":1},{"attempt_token":"zde4e9e15ce8a4f85","operation_token":"z54bf6985c0ce3b82","sequence":2}]},{"capture_contract_record_ids":["zbf1404c0dfb0e83a"],"contract_record_ids":["z4e166b0e99daa3b0"],"exact_type":"boolean","full_json_pointer":"/records/2/data/listing_complete","is_container":false,"json_pointer_relative_to_data":"/listing_complete","linked_record_ids":[],"record_id":"z1deeb2cb7d942540","value":true},{"capture_contract_record_ids":["zbf1404c0dfb0e83a"],"contract_record_ids":["z4e166b0e99daa3b0"],"exact_type":"boolean","full_json_pointer":"/records/5/data/listing_complete","is_container":false,"json_pointer_relative_to_data":"/listing_complete","linked_record_ids":[],"record_id":"z04dfbc829c4fa331","value":true},{"capture_contract_record_ids":["zbf1404c0dfb0e83a"],"contract_record_ids":["z4e166b0e99daa3b0"],"exact_type":"integer","full_json_pointer":"/records/0/data/posted_units","is_container":false,"json_pointer_relative_to_data":"/posted_units","linked_record_ids":[],"record_id":"z65bfa558d81d4a34","value":44},{"capture_contract_record_ids":["zbf1404c0dfb0e83a"],"contract_record_ids":["z4e166b0e99daa3b0"],"exact_type":"integer","full_json_pointer":"/records/1/data/captured_event_data/posted_units","is_container":false,"json_pointer_relative_to_data":"/captured_event_data/posted_units","linked_record_ids":["z283d225043d5111a"],"record_id":"z9c9ac5bd706f184c","value":22},{"capture_contract_record_ids":["zbf1404c0dfb0e83a"],"contract_record_ids":["z4e166b0e99daa3b0"],"exact_type":"integer","full_json_pointer":"/records/2/data/amount","is_container":false,"json_pointer_relative_to_data":"/amount","linked_record_ids":[],"record_id":"z1deeb2cb7d942540","value":22},{"capture_contract_record_ids":["zbf1404c0dfb0e83a"],"contract_record_ids":["z4e166b0e99daa3b0"],"exact_type":"integer","full_json_pointer":"/records/2/data/entries/0/sequence","is_container":false,"json_pointer_relative_to_data":"/entries/0/sequence","linked_record_ids":[],"record_id":"z1deeb2cb7d942540","value":1},{"capture_contract_record_ids":["zbf1404c0dfb0e83a"],"contract_record_ids":["z4e166b0e99daa3b0"],"exact_type":"integer","full_json_pointer":"/records/2/data/entries/1/sequence","is_container":false,"json_pointer_relative_to_data":"/entries/1/sequence","linked_record_ids":[],"record_id":"z1deeb2cb7d942540","value":2},{"capture_contract_record_ids":["zbf1404c0dfb0e83a"],"contract_record_ids":["z4e166b0e99daa3b0"],"exact_type":"integer","full_json_pointer":"/records/4/data/as_of","is_container":false,"json_pointer_relative_to_data":"/as_of","linked_record_ids":[],"record_id":"za2e0bf29086ef3c9","value":30},{"capture_contract_record_ids":["zbf1404c0dfb0e83a"],"contract_record_ids":["z4e166b0e99daa3b0"],"exact_type":"integer","full_json_pointer":"/records/5/data/amount","is_container":false,"json_pointer_relative_to_data":"/amount","linked_record_ids":[],"record_id":"z04dfbc829c4fa331","value":22},{"capture_contract_record_ids":["zbf1404c0dfb0e83a"],"contract_record_ids":["z4e166b0e99daa3b0"],"exact_type":"integer","full_json_pointer":"/records/5/data/entries/0/sequence","is_container":false,"json_pointer_relative_to_data":"/entries/0/sequence","linked_record_ids":[],"record_id":"z04dfbc829c4fa331","value":1},{"capture_contract_record_ids":["zbf1404c0dfb0e83a"],"contract_record_ids":["z4e166b0e99daa3b0"],"exact_type":"integer","full_json_pointer":"/records/5/data/entries/1/sequence","is_container":false,"json_pointer_relative_to_data":"/entries/1/sequence","linked_record_ids":[],"record_id":"z04dfbc829c4fa331","value":2},{"capture_contract_record_ids":["zbf1404c0dfb0e83a"],"contract_record_ids":["z4e166b0e99daa3b0"],"exact_type":"integer","full_json_pointer":"/records/6/data/posted_units","is_container":false,"json_pointer_relative_to_data":"/posted_units","linked_record_ids":["z9c9ac5bd706f184c"],"record_id":"z283d225043d5111a","value":22},{"capture_contract_record_ids":["zbf1404c0dfb0e83a"],"contract_record_ids":["z4e166b0e99daa3b0"],"exact_type":"object","full_json_pointer":"/records/0/data","is_container":true,"json_pointer_relative_to_data":"","linked_record_ids":[],"record_id":"z65bfa558d81d4a34","value":{"posted_units":44}},{"capture_contract_record_ids":["zbf1404c0dfb0e83a"],"contract_record_ids":["z4e166b0e99daa3b0"],"exact_type":"object","full_json_pointer":"/records/1/data","is_container":true,"json_pointer_relative_to_data":"","linked_record_ids":["z283d225043d5111a"],"record_id":"z9c9ac5bd706f184c","value":{"captured_event_data":{"posted_units":22},"deployment_version":"z5940676b99bea3d0","immutable_event_id":"zec10b48447987fce","recomputed_digest":"db48fe2b66fa1ac0e2451ae058e754973b73ce792a11e1963d4f7057d00217d0","recorded_digest":"db48fe2b66fa1ac0e2451ae058e754973b73ce792a11e1963d4f7057d00217d0"}},{"capture_contract_record_ids":["zbf1404c0dfb0e83a"],"contract_record_ids":["z4e166b0e99daa3b0"],"exact_type":"object","full_json_pointer":"/records/1/data/captured_event_data","is_container":true,"json_pointer_relative_to_data":"/captured_event_data","linked_record_ids":["z283d225043d5111a"],"record_id":"z9c9ac5bd706f184c","value":{"posted_units":22}},{"capture_contract_record_ids":["zbf1404c0dfb0e83a"],"contract_record_ids":["z4e166b0e99daa3b0"],"exact_type":"object","full_json_pointer":"/records/2/data","is_container":true,"json_pointer_relative_to_data":"","linked_record_ids":[],"record_id":"z1deeb2cb7d942540","value":{"amount":22,"entries":[{"attempt_token":"z4da1b3149655f568","operation_token":"z54bf6985c0ce3b82","sequence":1},{"attempt_token":"zde4e9e15ce8a4f85","operation_token":"z54bf6985c0ce3b82","sequence":2}],"key_column":"operation_token","listing_complete":true}},{"capture_contract_record_ids":["zbf1404c0dfb0e83a"],"contract_record_ids":["z4e166b0e99daa3b0"],"exact_type":"object","full_json_pointer":"/records/2/data/entries/0","is_container":true,"json_pointer_relative_to_data":"/entries/0","linked_record_ids":[],"record_id":"z1deeb2cb7d942540","value":{"attempt_token":"z4da1b3149655f568","operation_token":"z54bf6985c0ce3b82","sequence":1}},{"capture_contract_record_ids":["zbf1404c0dfb0e83a"],"contract_record_ids":["z4e166b0e99daa3b0"],"exact_type":"object","full_json_pointer":"/records/2/data/entries/1","is_container":true,"json_pointer_relative_to_data":"/entries/1","linked_record_ids":[],"record_id":"z1deeb2cb7d942540","value":{"attempt_token":"zde4e9e15ce8a4f85","operation_token":"z54bf6985c0ce3b82","sequence":2}},{"capture_contract_record_ids":["zbf1404c0dfb0e83a"],"contract_record_ids":["z4e166b0e99daa3b0"],"exact_type":"object","full_json_pointer":"/records/3/data","is_container":true,"json_pointer_relative_to_data":"","linked_record_ids":[],"record_id":"z4e166b0e99daa3b0","value":{"rule":"posted_units equals amount multiplied by the number of distinct operation_token values in the complete listing. Multiple attempt_token values for the same operation_token contribute only once. No other postings exist in this interval.","scope":"Each described component rule is complete for the presented inputs. No undocumented exceptions apply. UNKNOWN denotes omitted information, never a default value."}},{"capture_contract_record_ids":["zbf1404c0dfb0e83a"],"contract_record_ids":["z4e166b0e99daa3b0"],"exact_type":"object","full_json_pointer":"/records/4/data","is_container":true,"json_pointer_relative_to_data":"","linked_record_ids":[],"record_id":"za2e0bf29086ef3c9","value":{"as_of":30,"current_version":"z5940676b99bea3d0"}},{"capture_contract_record_ids":["zbf1404c0dfb0e83a"],"contract_record_ids":["z4e166b0e99daa3b0"],"exact_type":"object","full_json_pointer":"/records/5/data","is_container":true,"json_pointer_relative_to_data":"","linked_record_ids":[],"record_id":"z04dfbc829c4fa331","value":{"amount":22,"entries":[{"attempt_token":"z4da1b3149655f568","operation_token":"z54bf6985c0ce3b82","sequence":1},{"attempt_token":"zde4e9e15ce8a4f85","operation_token":"z54bf6985c0ce3b82","sequence":2}],"key_column":"attempt_token","listing_complete":true}},{"capture_contract_record_ids":["zbf1404c0dfb0e83a"],"contract_record_ids":["z4e166b0e99daa3b0"],"exact_type":"object","full_json_pointer":"/records/5/data/entries/0","is_container":true,"json_pointer_relative_to_data":"/entries/0","linked_record_ids":[],"record_id":"z04dfbc829c4fa331","value":{"attempt_token":"z4da1b3149655f568","operation_token":"z54bf6985c0ce3b82","sequence":1}},{"capture_contract_record_ids":["zbf1404c0dfb0e83a"],"contract_record_ids":["z4e166b0e99daa3b0"],"exact_type":"object","full_json_pointer":"/records/5/data/entries/1","is_container":true,"json_pointer_relative_to_data":"/entries/1","linked_record_ids":[],"record_id":"z04dfbc829c4fa331","value":{"attempt_token":"zde4e9e15ce8a4f85","operation_token":"z54bf6985c0ce3b82","sequence":2}},{"capture_contract_record_ids":["zbf1404c0dfb0e83a"],"contract_record_ids":["z4e166b0e99daa3b0"],"exact_type":"object","full_json_pointer":"/records/6/data","is_container":true,"json_pointer_relative_to_data":"","linked_record_ids":["z9c9ac5bd706f184c"],"record_id":"z283d225043d5111a","value":{"posted_units":22}},{"capture_contract_record_ids":["z